{
  "$schema": "http://json-schema.org/draft-07/schema#",
  "$id": "config.schema.json",
  "title": "ATV Controller Configuration",
  "type": "object",
  "required": ["device", "tasks"],
  "additionalProperties": false,
  "properties": {
    "_comment": { "type": "string" },
    "device": {
      "type": "object",
      "required": ["ip", "port"],
      "additionalProperties": false,
      "properties": {
        "_comment": { "type": "string" },
        "ip": { "type": "string", "format": "ipv4" },
        "port": { "type": "integer", "minimum": 1, "maximum": 65535 }
      }
    },
    "tasks": {
      "type": "array",
      "items": { "$ref": "#/definitions/task" }
    },
    "mqtt": {
      "type": "object",
      "description": "Optional: MQTT configuration for Home Assistant Auto-Discovery",
      "additionalProperties": false,
      "properties": {
        "_comment": { "type": "string" },
        "url": { 
          "type": "string",
          "description": "MQTT broker URL (e.g., mqtt://192.168.1.100:1883)"
        },
        "username": { "type": "string" },
        "password": { "type": "string" },
        "topic_prefix": { 
          "type": "string",
          "default": "homeassistant"
        }
      },
      "required": ["url"]
    },
    "youtube": {
      "type": "object",
      "description": "Optional: Custom YouTube client configuration (e.g., SmartTube)",
      "additionalProperties": false,
      "properties": {
        "_comment": { "type": "string" },
        "package": { 
          "type": "string",
          "description": "Package name of the YouTube client app"
        },
        "activity": { 
          "type": "string",
          "description": "Activity to launch for video playback"
        }
      },
      "required": ["package", "activity"]
    }
  },
  "definitions": {
    "task": {
      "type": "object",
      "required": ["name", "schedule", "actions"],
      "additionalProperties": false,
      "properties": {
        "_comment": { "type": "string" },
        "name": { "type": "string", "minLength": 1 },
        "schedule": { "type": "string" },
        "actions": {
          "type": "array",
          "items": { "$ref": "#/definitions/action" }
        }
      }
    },
    "action": {
      "oneOf": [
        { "$ref": "#/definitions/wakeAction" },
        { "$ref": "#/definitions/waitAction" },
        { "$ref": "#/definitions/playVideoAction" },
        { "$ref": "#/definitions/launchAppAction" },
        { "$ref": "#/definitions/forceStopAction" },
        { "$ref": "#/definitions/clearCacheAction" },
        { "$ref": "#/definitions/installAppAction" },
        { "$ref": "#/definitions/uninstallAppAction" },
        { "$ref": "#/definitions/shutdownAction" }
      ]
    },
    "wakeAction": {
      "type": "object",
      "required": ["type"],
      "additionalProperties": false,
      "properties": {
        "_comment": { "type": "string" },
        "type": { "const": "wake" }
      }
    },
    "waitAction": {
      "type": "object",
      "required": ["type", "duration"],
      "additionalProperties": false,
      "properties": {
        "_comment": { "type": "string" },
        "type": { "const": "wait" },
        "duration": { "type": "integer", "minimum": 0 }
      }
    },
    "playVideoAction": {
      "type": "object",
      "required": ["type", "url"],
      "additionalProperties": false,
      "properties": {
        "_comment": { "type": "string" },
        "type": { "const": "play-video" },
        "url": { "type": "string", "format": "uri" }
      }
    },
    "launchAppAction": {
      "type": "object",
      "required": ["type", "package"],
      "additionalProperties": false,
      "properties": {
        "_comment": { "type": "string" },
        "type": { "const": "launch-app" },
        "package": { "type": "string" },
        "activity": { "type": "string" }
      }
    },
    "shutdownAction": {
      "type": "object",
      "required": ["type"],
      "additionalProperties": false,
      "properties": {
        "_comment": { "type": "string" },
        "type": { "const": "shutdown" }
      }
    },
    "forceStopAction": {
      "type": "object",
      "required": ["type", "package"],
      "additionalProperties": false,
      "properties": {
        "_comment": { "type": "string" },
        "type": { "const": "force-stop" },
        "package": { "type": "string" }
      }
    },
    "clearCacheAction": {
      "type": "object",
      "required": ["type", "package"],
      "additionalProperties": false,
      "properties": {
        "_comment": { "type": "string" },
        "type": { "const": "clear-cache" },
        "package": { "type": "string" }
      }
    },
    "installAppAction": {
      "type": "object",
      "required": ["type", "apkPath"],
      "additionalProperties": false,
      "properties": {
        "_comment": { "type": "string" },
        "type": { "const": "install-app" },
        "apkPath": { "type": "string" }
      }
    },
    "uninstallAppAction": {
      "type": "object",
      "required": ["type", "package"],
      "additionalProperties": false,
      "properties": {
        "_comment": { "type": "string" },
        "type": { "const": "uninstall-app" },
        "package": { "type": "string" }
      }
    }
  }
}
